<?xml version="1.0"?>
<!DOCTYPE Report
[
<!ELEMENT Report (General ,(Doc|BPT)) >
<!ATTLIST Report ver CDATA #REQUIRED tmZone CDATA #REQUIRED>

<!ELEMENT General ( DocLocation ) >
<!ATTLIST General productName CDATA #REQUIRED productVer CDATA #REQUIRED os CDATA #REQUIRED host CDATA #REQUIRED qcserver CDATA #IMPLIED qcproject CDATA #IMPLIED SolManSolutionId CDATA #IMPLIED SolManProjectId CDATA #IMPLIED SolManTestPlanId CDATA #IMPLIED SolManTestPackageId CDATA #IMPLIED SolManUserInfoData CDATA #IMPLIED  >

<!ELEMENT BPT (DName,Res,DVer?,TSet?,TInst?,NodeArgs,AdditionalInfo*,Doc*) >
<!ATTLIST BPT rID ID #REQUIRED >

<!ELEMENT Doc (DName,ConfName?,Res,DVer?,TSet?,TInst?,RunType?,DT?,AdditionalInfo*,Step*,DIter*,Step*,Action*,Doc*,Summary?,TestMaintenanceSummary*,NodeArgs?) >
<!ATTLIST Doc rID ID #REQUIRED type (Test|BC|BPTWrapperTest|Flow|Group|Action) "Test" productName CDATA #REQUIRED BCIter CDATA #IMPLIED >

<!ELEMENT RunType ( #PCDATA )>
<!ATTLIST RunType fmStep (False|True) "False" batch (False|True) "False" upDesc (False|True) "False" upChk (False|True) "False" upAS (False|True) "False">

<!ELEMENT DName ( #PCDATA ) >

<!ELEMENT ConfName ( #PCDATA ) >

<!ELEMENT Res ( #PCDATA ) >

<!ELEMENT AdditionalInfo (AdditionalDataName,AdditionalDataValue ) >

<!ELEMENT AdditionalDataName ( #PCDATA ) >

<!ELEMENT AdditionalDataValue ( #PCDATA ) >

<!ELEMENT DVer ( #PCDATA ) >

<!ELEMENT TSet ( #PCDATA ) >

<!ELEMENT TInst ( #PCDATA ) >

<!ELEMENT DIter (Step*,Action+,Summary?,NodeArgs)>
<!ATTLIST DIter rID ID #REQUIRED iterID CDATA #REQUIRED>

<!ELEMENT DocLocation ( #PCDATA )>

<!ELEMENT Action (AName,AIter*,(Step|HtmlStep|Action)*, Summary,ActionMaintenanceSummary*, NodeArgs ) >
<!ATTLIST Action rID ID #REQUIRED>

<!ELEMENT AIter ((Step|HtmlStep|Action)*,DataMapping?, Summary?,NodeArgs) >
<!ATTLIST AIter rID ID #REQUIRED iterID CDATA #REQUIRED isCountable (False|True) "False" >

<!ELEMENT AName ( #PCDATA ) >

<!ELEMENT TestMaintenanceSummary (ActionMaintenanceSummary*) >
<!ATTLIST TestMaintenanceSummary ObjectsAdded CDATA #REQUIRED ObjectsUpdated CDATA #REQUIRED StepsUpdated CDATA #REQUIRED StepsComments CDATA #REQUIRED><!ELEMENT ActionMaintenanceSummary (ObjectChange* ) >
<!ATTLIST ActionMaintenanceSummary Action CDATA #REQUIRED Objects CDATA #REQUIRED Updated CDATA #REQUIRED LinesTotal CDATA #REQUIRED Added CDATA #REQUIRED LinesUpdated CDATA #REQUIRED>

<!ELEMENT ObjectChange  (Hierarchy, PropertyChangeList* ) >
<!ATTLIST ObjectChange Operation CDATA #IMPLIED OriginalRepository CDATA #IMPLIED>

<!ELEMENT PropertyChangeList (PropertyDef*) >

<!ELEMENT PropertyDef (OriginalValue, NewValue) >
<!ATTLIST PropertyDef PropName CDATA #REQUIRED OriginRegularExpression (True|False) "False" NewRegularExpression (True|False) "False" AddedProperty (True|False) "False" >

<!ELEMENT OriginalValue ( #PCDATA )>

<!ELEMENT NewValue ( #PCDATA )>

<!ELEMENT Hierarchy  (ObjectName, Hierarchy*) >
<!ATTLIST Hierarchy MicClass CDATA #REQUIRED>

<!ELEMENT ObjectName  ( #PCDATA ) >

<!ELEMENT Step (Obj,Details,Time,TimeTick* ,(Step|HtmlStep|Doc)*, DataMapping?, NodeArgs) >
<!ATTLIST Step rID ID #REQUIRED retval CDATA #IMPLIED>

<!ELEMENT HtmlStep (HTML,TimeTick*,(Step|HtmlStep|Doc)*,NodeArgs) >
<!ATTLIST HtmlStep rID ID #REQUIRED >

<!ELEMENT Obj ( #PCDATA ) >
<!ATTLIST Obj plainTxt (False|True) "True">

<!ELEMENT Details ( #PCDATA ) >
<!ATTLIST Details plainTxt (False|True) "True">

<!ELEMENT Time ( #PCDATA ) >

<!ELEMENT HTML ( #PCDATA ) >

<!ELEMENT Disp ( #PCDATA ) >

<!ELEMENT TimeTick ( #PCDATA ) >

<!ELEMENT DataMapping ( DataMappedItem* )>
<!ELEMENT DataMappedItem EMPTY >
<!ATTLIST DataMappedItem dsName CDATA #REQUIRED >
<!ATTLIST DataMappedItem rowId CDATA #REQUIRED >

<!ELEMENT NodeArgs (Disp,TopPane?,BtmPane?,ExtendedInfo? )>
<!ATTLIST NodeArgs eType CDATA #REQUIRED icon CDATA #REQUIRED nRep CDATA #REQUIRED UserNote CDATA #IMPLIED filter (False|True) "True">
<!ATTLIST NodeArgs status (Passed|Failed|Done|Warning|Information) "Done">
<!ATTLIST NodeArgs iconSel CDATA #IMPLIED nType CDATA #IMPLIED MovieMarker CDATA "">
<!ATTLIST NodeArgs Source CDATA #IMPLIED SourceLine CDATA #IMPLIED StepFlowItemKey CDATA #IMPLIED >

<!ELEMENT TopPane (Path)>

<!ELEMENT BtmPane ( (Path|WR)?,ASHilite?)>
<!ATTLIST BtmPane vType CDATA "HTML">

<!ELEMENT Path ( #PCDATA ) >

<!ELEMENT ASHilite ( #PCDATA ) >

<!ELEMENT WR ( #PCDATA ) >

<!ELEMENT ExtendedInfo ( StepData ) >

<!ATTLIST ExtendedInfo StepType CDATA #REQUIRED>
<!ELEMENT DT (NodeArgs) >
<!ATTLIST DT rID ID #REQUIRED>

<!ELEMENT Summary (Param*)>
<!ATTLIST Summary sTime CDATA #IMPLIED eTime CDATA #IMPLIED passed CDATA #IMPLIED failed CDATA #IMPLIED warnings CDATA #IMPLIED retval CDATA #IMPLIED stopped (False|True) "False" >

<!ELEMENT Param (ParamName,ParamVal)+ >
<!ATTLIST Param paramInOut (In|Out) "In">

<!ELEMENT ParamName ( #PCDATA ) >

<!ELEMENT ParamVal ( #PCDATA ) >

]
>
<Report ver="2.0" tmZone="India Standard Time">
<General productName="HPE Unified Functional Testing" productVer="14.02" os="Windows 7" host="INPUHJLP06355"><DocLocation><![CDATA[C:\Git_Repo\UFT_Octane_Test\UFT_Octane_Integ]]></DocLocation></General>
<Doc rID="T1"   productName= "HPE Unified Functional Testing"  >
<DName><![CDATA[UFT_Octane_Integ]]></DName>
<Res><![CDATA[UFT_Octane_Integ]]></Res>
<DT rID="T2">
<NodeArgs eType="Table" icon="84" nRep="4" filter="False" >
<Disp><![CDATA[Run-Time Data Table]]></Disp>
<BtmPane vType="Table" >
<Path><![CDATA[Default.xls]]></Path>
</BtmPane>
</NodeArgs>
</DT>
<DIter rID="T3" iterID="1" >
<Action rID="T4">
<AName><![CDATA[Action1]]></AName>
<Step rID="T5">
<Obj plainTxt="False" ><![CDATA[SystemUtil]]></Obj>
<Details plainTxt="False" ><![CDATA[SystemUtil]]></Details>
<Time><![CDATA[23/05/2018 - 22:08:04]]></Time>
<TimeTick>1527093484</TimeTick>
<Step rID="T6">
<Obj plainTxt="False" ><![CDATA[Run "iexplore.exe",1]]></Obj>
<Details plainTxt="False" ><![CDATA[Run "iexplore.exe",1]]></Details>
<Time><![CDATA[23/05/2018 - 22:08:04]]></Time>
<TimeTick>1527093484</TimeTick>
<NodeArgs eType="Replay" icon="87" nRep="11" status="Passed" Source="Action1" SourceLine="-1" >
<Disp><![CDATA[Run "iexplore.exe",1]]></Disp>
</NodeArgs>
</Step>
<NodeArgs eType="Replay" icon="87" nRep="10" status="Passed" Source="Action1" SourceLine="-1" >
<Disp><![CDATA[SystemUtil]]></Disp>
</NodeArgs>
</Step>
<Step rID="T7">
<Obj plainTxt="False" ><![CDATA[[ WebButton ].Exist]]></Obj>
<Details plainTxt="False" ><![CDATA["Object does not exist"]]></Details>
<Time><![CDATA[23/05/2018 - 22:08:05]]></Time>
<TimeTick>1527093485</TimeTick>
<NodeArgs eType="Replay" icon="88" nRep="19" Source="Action1" SourceLine="-1" >
<Disp><![CDATA[[ WebButton ].Exist]]></Disp>
</NodeArgs>
</Step>
<Step rID="T8">
<Obj plainTxt="False" ><![CDATA[[ WebButton ].Exist]]></Obj>
<Details plainTxt="False" ><![CDATA["Object does not exist"]]></Details>
<Time><![CDATA[23/05/2018 - 22:08:07]]></Time>
<TimeTick>1527093487</TimeTick>
<NodeArgs eType="Replay" icon="88" nRep="27" Source="Action1" SourceLine="-1" >
<Disp><![CDATA[[ WebButton ].Exist]]></Disp>
</NodeArgs>
</Step>
<Step rID="T9">
<Obj plainTxt="False" ><![CDATA[[ WebButton ].Exist]]></Obj>
<Details plainTxt="False" ><![CDATA["Object does not exist"]]></Details>
<Time><![CDATA[23/05/2018 - 22:08:08]]></Time>
<TimeTick>1527093488</TimeTick>
<NodeArgs eType="Replay" icon="88" nRep="35" Source="Action1" SourceLine="-1" >
<Disp><![CDATA[[ WebButton ].Exist]]></Disp>
</NodeArgs>
</Step>
<Step rID="T10">
<Obj plainTxt="False" ><![CDATA[[ WebButton ].Exist]]></Obj>
<Details plainTxt="False" ><![CDATA["Object does not exist"]]></Details>
<Time><![CDATA[23/05/2018 - 22:08:10]]></Time>
<TimeTick>1527093490</TimeTick>
<NodeArgs eType="Replay" icon="88" nRep="43" Source="Action1" SourceLine="-1" >
<Disp><![CDATA[[ WebButton ].Exist]]></Disp>
</NodeArgs>
</Step>
<Step rID="T11">
<Obj plainTxt="False" ><![CDATA[[ WebButton ].Exist]]></Obj>
<Details plainTxt="False" ><![CDATA["Object does not exist"]]></Details>
<Time><![CDATA[23/05/2018 - 22:08:11]]></Time>
<TimeTick>1527093491</TimeTick>
<NodeArgs eType="Replay" icon="88" nRep="51" Source="Action1" SourceLine="-1" >
<Disp><![CDATA[[ WebButton ].Exist]]></Disp>
</NodeArgs>
</Step>
<Step rID="T12">
<Obj plainTxt="False" ><![CDATA[[ WebButton ].Exist]]></Obj>
<Details plainTxt="False" ><![CDATA["Object does not exist"]]></Details>
<Time><![CDATA[23/05/2018 - 22:08:13]]></Time>
<TimeTick>1527093493</TimeTick>
<NodeArgs eType="Replay" icon="88" nRep="59" Source="Action1" SourceLine="-1" >
<Disp><![CDATA[[ WebButton ].Exist]]></Disp>
</NodeArgs>
</Step>
<Step rID="T13">
<Obj plainTxt="False" ><![CDATA[[ WebButton ].Exist]]></Obj>
<Details plainTxt="False" ><![CDATA["Object does not exist"]]></Details>
<Time><![CDATA[23/05/2018 - 22:08:14]]></Time>
<TimeTick>1527093494</TimeTick>
<NodeArgs eType="Replay" icon="88" nRep="67" Source="Action1" SourceLine="-1" >
<Disp><![CDATA[[ WebButton ].Exist]]></Disp>
</NodeArgs>
</Step>
<Step rID="T14">
<Obj plainTxt="False" ><![CDATA[[ WebButton ].Exist]]></Obj>
<Details plainTxt="False" ><![CDATA["Object does not exist"]]></Details>
<Time><![CDATA[23/05/2018 - 22:08:15]]></Time>
<TimeTick>1527093495</TimeTick>
<NodeArgs eType="Replay" icon="88" nRep="75" Source="Action1" SourceLine="-1" >
<Disp><![CDATA[[ WebButton ].Exist]]></Disp>
</NodeArgs>
</Step>
<Step rID="T15">
<Obj plainTxt="False" ><![CDATA[[ WebButton ].Exist]]></Obj>
<Details plainTxt="False" ><![CDATA["Object does not exist"]]></Details>
<Time><![CDATA[23/05/2018 - 22:08:17]]></Time>
<TimeTick>1527093497</TimeTick>
<NodeArgs eType="Replay" icon="88" nRep="83" Source="Action1" SourceLine="-1" >
<Disp><![CDATA[[ WebButton ].Exist]]></Disp>
</NodeArgs>
</Step>
<Step rID="T16">
<Obj plainTxt="False" ><![CDATA[[ WebButton ].Exist]]></Obj>
<Details plainTxt="False" ><![CDATA["Object does not exist"]]></Details>
<Time><![CDATA[23/05/2018 - 22:08:18]]></Time>
<TimeTick>1527093498</TimeTick>
<NodeArgs eType="Replay" icon="88" nRep="91" Source="Action1" SourceLine="-1" >
<Disp><![CDATA[[ WebButton ].Exist]]></Disp>
</NodeArgs>
</Step>
<Step rID="T17">
<Obj plainTxt="False" ><![CDATA[[ WebButton ].Exist]]></Obj>
<Details plainTxt="False" ><![CDATA["Object does not exist"]]></Details>
<Time><![CDATA[23/05/2018 - 22:08:20]]></Time>
<TimeTick>1527093500</TimeTick>
<NodeArgs eType="Replay" icon="88" nRep="99" Source="Action1" SourceLine="-1" >
<Disp><![CDATA[[ WebButton ].Exist]]></Disp>
</NodeArgs>
</Step>
<Step rID="T18">
<Obj plainTxt="False" ><![CDATA[[ WebButton ].Exist]]></Obj>
<Details plainTxt="False" ><![CDATA["Object does not exist"]]></Details>
<Time><![CDATA[23/05/2018 - 22:08:21]]></Time>
<TimeTick>1527093501</TimeTick>
<NodeArgs eType="Replay" icon="88" nRep="107" Source="Action1" SourceLine="-1" >
<Disp><![CDATA[[ WebButton ].Exist]]></Disp>
</NodeArgs>
</Step>
<Step rID="T19">
<Obj plainTxt="False" ><![CDATA[[ WebButton ].Exist]]></Obj>
<Details plainTxt="False" ><![CDATA["Object does not exist"]]></Details>
<Time><![CDATA[23/05/2018 - 22:08:32]]></Time>
<TimeTick>1527093512</TimeTick>
<NodeArgs eType="Replay" icon="88" nRep="110" Source="Action1" SourceLine="-1" >
<Disp><![CDATA[[ WebButton ].Exist]]></Disp>
</NodeArgs>
</Step>
<Step rID="T20">
<Obj plainTxt="False" ><![CDATA[[ LOGIN ].Exist]]></Obj>
<Details plainTxt="False" ><![CDATA["Object exists"]]></Details>
<Time><![CDATA[23/05/2018 - 22:08:32]]></Time>
<TimeTick>1527093512</TimeTick>
<NodeArgs eType="Replay" icon="88" nRep="112" Source="Action1" SourceLine="-1" >
<Disp><![CDATA[[ LOGIN ].Exist]]></Disp>
</NodeArgs>
</Step>
<Step rID="T21">
<Obj plainTxt="False" ><![CDATA[[ txtUsername ].Exist]]></Obj>
<Details plainTxt="False" ><![CDATA["Object exists"]]></Details>
<Time><![CDATA[23/05/2018 - 22:08:32]]></Time>
<TimeTick>1527093512</TimeTick>
<NodeArgs eType="Replay" icon="89" nRep="114" Source="Action1" SourceLine="-1" >
<Disp><![CDATA[[ txtUsername ].Exist]]></Disp>
</NodeArgs>
</Step>
<Step rID="T22">
<Obj plainTxt="False" ><![CDATA[[ txtUsername ].Set]]></Obj>
<Details plainTxt="False" ><![CDATA["Admin"]]></Details>
<Time><![CDATA[23/05/2018 - 22:08:33]]></Time>
<TimeTick>1527093513</TimeTick>
<NodeArgs eType="Replay" icon="89" nRep="117" Source="Action1" SourceLine="-1" >
<Disp><![CDATA[[ txtUsername ].Set]]></Disp>
</NodeArgs>
</Step>
<Step rID="T23">
<Obj ><![CDATA[Username Set]]></Obj>
<Details ><![CDATA[Successfully Set]]></Details>
<Time><![CDATA[23/05/2018 - 22:08:33]]></Time>
<TimeTick>1527093513</TimeTick>
<NodeArgs eType="User" icon="90" nRep="118" status="Passed" Source="Action1" SourceLine="-1" >
<Disp><![CDATA[Username Set]]></Disp>
</NodeArgs>
</Step>
<Step rID="T24">
<Obj plainTxt="False" ><![CDATA[[ txtPassword ].Exist]]></Obj>
<Details plainTxt="False" ><![CDATA["Object exists"]]></Details>
<Time><![CDATA[23/05/2018 - 22:08:33]]></Time>
<TimeTick>1527093513</TimeTick>
<NodeArgs eType="Replay" icon="89" nRep="120" Source="Action1" SourceLine="-1" >
<Disp><![CDATA[[ txtPassword ].Exist]]></Disp>
</NodeArgs>
</Step>
<Step rID="T25">
<Obj plainTxt="False" ><![CDATA[[ txtPassword ].SetSecure]]></Obj>
<Details plainTxt="False" ><![CDATA["5b051c35be3517e6cada111aa95cf7ba"]]></Details>
<Time><![CDATA[23/05/2018 - 22:08:33]]></Time>
<TimeTick>1527093513</TimeTick>
<NodeArgs eType="Replay" icon="89" nRep="123" Source="Action1" SourceLine="-1" >
<Disp><![CDATA[[ txtPassword ].SetSecure]]></Disp>
</NodeArgs>
</Step>
<Step rID="T26">
<Obj ><![CDATA[Password Set]]></Obj>
<Details ><![CDATA[Successfully Set]]></Details>
<Time><![CDATA[23/05/2018 - 22:08:33]]></Time>
<TimeTick>1527093513</TimeTick>
<NodeArgs eType="User" icon="90" nRep="124" status="Passed" Source="Action1" SourceLine="-1" >
<Disp><![CDATA[Password Set]]></Disp>
</NodeArgs>
</Step>
<Step rID="T27">
<Obj plainTxt="False" ><![CDATA[[ LOGIN ].Exist]]></Obj>
<Details plainTxt="False" ><![CDATA["Object exists"]]></Details>
<Time><![CDATA[23/05/2018 - 22:08:33]]></Time>
<TimeTick>1527093513</TimeTick>
<NodeArgs eType="Replay" icon="88" nRep="126" Source="Action1" SourceLine="-1" >
<Disp><![CDATA[[ LOGIN ].Exist]]></Disp>
</NodeArgs>
</Step>
<Step rID="T28">
<Obj plainTxt="False" ><![CDATA[[ LOGIN ].Click]]></Obj>
<Details plainTxt="False" ><![CDATA[]]></Details>
<Time><![CDATA[23/05/2018 - 22:08:34]]></Time>
<TimeTick>1527093514</TimeTick>
<NodeArgs eType="Replay" icon="88" nRep="129" Source="Action1" SourceLine="-1" >
<Disp><![CDATA[[ LOGIN ].Click]]></Disp>
</NodeArgs>
</Step>
<Step rID="T29">
<Obj ><![CDATA[Login Button Click]]></Obj>
<Details ><![CDATA[Successfully Clicked]]></Details>
<Time><![CDATA[23/05/2018 - 22:08:34]]></Time>
<TimeTick>1527093514</TimeTick>
<NodeArgs eType="User" icon="90" nRep="130" status="Passed" Source="Action1" SourceLine="-1" >
<Disp><![CDATA[Login Button Click]]></Disp>
</NodeArgs>
</Step>
<Step rID="T30">
<Obj plainTxt="False" ><![CDATA[[ PIM ].Exist]]></Obj>
<Details plainTxt="False" ><![CDATA["Object exists"]]></Details>
<Time><![CDATA[23/05/2018 - 22:08:39]]></Time>
<TimeTick>1527093519</TimeTick>
<NodeArgs eType="Replay" icon="91" nRep="132" Source="Action1" SourceLine="-1" >
<Disp><![CDATA[[ PIM ].Exist]]></Disp>
</NodeArgs>
</Step>
<Step rID="T31">
<Obj plainTxt="False" ><![CDATA[[ PIM ].Click]]></Obj>
<Details plainTxt="False" ><![CDATA[]]></Details>
<Time><![CDATA[23/05/2018 - 22:08:40]]></Time>
<TimeTick>1527093520</TimeTick>
<NodeArgs eType="Replay" icon="91" nRep="135" Source="Action1" SourceLine="-1" >
<Disp><![CDATA[[ PIM ].Click]]></Disp>
</NodeArgs>
</Step>
<Step rID="T32">
<Obj ><![CDATA[PIM Link Click]]></Obj>
<Details ><![CDATA[Successfully Clicked]]></Details>
<Time><![CDATA[23/05/2018 - 22:08:40]]></Time>
<TimeTick>1527093520</TimeTick>
<NodeArgs eType="User" icon="90" nRep="136" status="Passed" Source="Action1" SourceLine="-1" >
<Disp><![CDATA[PIM Link Click]]></Disp>
</NodeArgs>
</Step>
<Step rID="T33">
<Obj plainTxt="False" ><![CDATA[[ Add Employee ].Exist]]></Obj>
<Details plainTxt="False" ><![CDATA["Object exists"]]></Details>
<Time><![CDATA[23/05/2018 - 22:08:42]]></Time>
<TimeTick>1527093522</TimeTick>
<NodeArgs eType="Replay" icon="91" nRep="138" Source="Action1" SourceLine="-1" >
<Disp><![CDATA[[ Add Employee ].Exist]]></Disp>
</NodeArgs>
</Step>
<Step rID="T34">
<Obj plainTxt="False" ><![CDATA[[ Add Employee ].Click]]></Obj>
<Details plainTxt="False" ><![CDATA[]]></Details>
<Time><![CDATA[23/05/2018 - 22:08:42]]></Time>
<TimeTick>1527093522</TimeTick>
<NodeArgs eType="Replay" icon="91" nRep="141" Source="Action1" SourceLine="-1" >
<Disp><![CDATA[[ Add Employee ].Click]]></Disp>
</NodeArgs>
</Step>
<Step rID="T35">
<Obj ><![CDATA[Add Employee Link Click]]></Obj>
<Details ><![CDATA[Successfully Clicked]]></Details>
<Time><![CDATA[23/05/2018 - 22:08:42]]></Time>
<TimeTick>1527093522</TimeTick>
<NodeArgs eType="User" icon="90" nRep="142" status="Passed" Source="Action1" SourceLine="-1" >
<Disp><![CDATA[Add Employee Link Click]]></Disp>
</NodeArgs>
</Step>
<Step rID="T36">
<Obj plainTxt="False" ><![CDATA[[ firstName ].Exist]]></Obj>
<Details plainTxt="False" ><![CDATA["Object exists"]]></Details>
<Time><![CDATA[23/05/2018 - 22:08:43]]></Time>
<TimeTick>1527093523</TimeTick>
<NodeArgs eType="Replay" icon="89" nRep="144" Source="Action1" SourceLine="-1" >
<Disp><![CDATA[[ firstName ].Exist]]></Disp>
</NodeArgs>
</Step>
<Step rID="T37">
<Obj plainTxt="False" ><![CDATA[[ firstName ].Set]]></Obj>
<Details plainTxt="False" ><![CDATA["Josh"]]></Details>
<Time><![CDATA[23/05/2018 - 22:08:44]]></Time>
<TimeTick>1527093524</TimeTick>
<NodeArgs eType="Replay" icon="89" nRep="147" Source="Action1" SourceLine="-1" >
<Disp><![CDATA[[ firstName ].Set]]></Disp>
</NodeArgs>
</Step>
<Step rID="T38">
<Obj ><![CDATA[First Name Set]]></Obj>
<Details ><![CDATA[Successfully Set]]></Details>
<Time><![CDATA[23/05/2018 - 22:08:44]]></Time>
<TimeTick>1527093524</TimeTick>
<NodeArgs eType="User" icon="90" nRep="148" status="Passed" Source="Action1" SourceLine="-1" >
<Disp><![CDATA[First Name Set]]></Disp>
</NodeArgs>
</Step>
<Step rID="T39">
<Obj plainTxt="False" ><![CDATA[[ lastName ].Exist]]></Obj>
<Details plainTxt="False" ><![CDATA["Object exists"]]></Details>
<Time><![CDATA[23/05/2018 - 22:08:44]]></Time>
<TimeTick>1527093524</TimeTick>
<NodeArgs eType="Replay" icon="89" nRep="150" Source="Action1" SourceLine="-1" >
<Disp><![CDATA[[ lastName ].Exist]]></Disp>
</NodeArgs>
</Step>
<Step rID="T40">
<Obj plainTxt="False" ><![CDATA[[ lastName ].Set]]></Obj>
<Details plainTxt="False" ><![CDATA["Bryan"]]></Details>
<Time><![CDATA[23/05/2018 - 22:08:44]]></Time>
<TimeTick>1527093524</TimeTick>
<NodeArgs eType="Replay" icon="89" nRep="153" Source="Action1" SourceLine="-1" >
<Disp><![CDATA[[ lastName ].Set]]></Disp>
</NodeArgs>
</Step>
<Step rID="T41">
<Obj ><![CDATA[Last Name Set]]></Obj>
<Details ><![CDATA[Successfully Set]]></Details>
<Time><![CDATA[23/05/2018 - 22:08:44]]></Time>
<TimeTick>1527093524</TimeTick>
<NodeArgs eType="User" icon="90" nRep="154" status="Passed" Source="Action1" SourceLine="-1" >
<Disp><![CDATA[Last Name Set]]></Disp>
</NodeArgs>
</Step>
<Step rID="T42">
<Obj plainTxt="False" ><![CDATA[[ chkLogin ].Exist]]></Obj>
<Details plainTxt="False" ><![CDATA["Object exists"]]></Details>
<Time><![CDATA[23/05/2018 - 22:08:44]]></Time>
<TimeTick>1527093524</TimeTick>
<NodeArgs eType="Replay" icon="92" nRep="156" Source="Action1" SourceLine="-1" >
<Disp><![CDATA[[ chkLogin ].Exist]]></Disp>
</NodeArgs>
</Step>
<Step rID="T43">
<Obj plainTxt="False" ><![CDATA[[ chkLogin ].Set]]></Obj>
<Details plainTxt="False" ><![CDATA["ON"]]></Details>
<Time><![CDATA[23/05/2018 - 22:08:45]]></Time>
<TimeTick>1527093525</TimeTick>
<NodeArgs eType="Replay" icon="92" nRep="159" Source="Action1" SourceLine="-1" >
<Disp><![CDATA[[ chkLogin ].Set]]></Disp>
</NodeArgs>
</Step>
<Step rID="T44">
<Obj ><![CDATA[Check box Set]]></Obj>
<Details ><![CDATA[Successfully Set]]></Details>
<Time><![CDATA[23/05/2018 - 22:08:45]]></Time>
<TimeTick>1527093525</TimeTick>
<NodeArgs eType="User" icon="90" nRep="160" status="Passed" Source="Action1" SourceLine="-1" >
<Disp><![CDATA[Check box Set]]></Disp>
</NodeArgs>
</Step>
<Step rID="T45">
<Obj plainTxt="False" ><![CDATA[[ user_name ].Exist]]></Obj>
<Details plainTxt="False" ><![CDATA["Object exists"]]></Details>
<Time><![CDATA[23/05/2018 - 22:08:45]]></Time>
<TimeTick>1527093525</TimeTick>
<NodeArgs eType="Replay" icon="89" nRep="162" Source="Action1" SourceLine="-1" >
<Disp><![CDATA[[ user_name ].Exist]]></Disp>
</NodeArgs>
</Step>
<Step rID="T46">
<Obj plainTxt="False" ><![CDATA[[ user_name ].Set]]></Obj>
<Details plainTxt="False" ><![CDATA["JBryan"]]></Details>
<Time><![CDATA[23/05/2018 - 22:08:45]]></Time>
<TimeTick>1527093525</TimeTick>
<NodeArgs eType="Replay" icon="89" nRep="165" Source="Action1" SourceLine="-1" >
<Disp><![CDATA[[ user_name ].Set]]></Disp>
</NodeArgs>
</Step>
<Step rID="T47">
<Obj ><![CDATA[User Name Set]]></Obj>
<Details ><![CDATA[Successfully Set]]></Details>
<Time><![CDATA[23/05/2018 - 22:08:45]]></Time>
<TimeTick>1527093525</TimeTick>
<NodeArgs eType="User" icon="90" nRep="166" status="Passed" Source="Action1" SourceLine="-1" >
<Disp><![CDATA[User Name Set]]></Disp>
</NodeArgs>
</Step>
<Step rID="T48">
<Obj plainTxt="False" ><![CDATA[[ user_password ].Exist]]></Obj>
<Details plainTxt="False" ><![CDATA["Object exists"]]></Details>
<Time><![CDATA[23/05/2018 - 22:08:45]]></Time>
<TimeTick>1527093525</TimeTick>
<NodeArgs eType="Replay" icon="89" nRep="168" Source="Action1" SourceLine="-1" >
<Disp><![CDATA[[ user_password ].Exist]]></Disp>
</NodeArgs>
</Step>
<Step rID="T49">
<Obj plainTxt="False" ><![CDATA[[ user_password ].SetSecure]]></Obj>
<Details plainTxt="False" ><![CDATA["5b005ccbe5c8a2f35ee86f922906d5709d536f1d67bc"]]></Details>
<Time><![CDATA[23/05/2018 - 22:08:46]]></Time>
<TimeTick>1527093526</TimeTick>
<NodeArgs eType="Replay" icon="89" nRep="171" Source="Action1" SourceLine="-1" >
<Disp><![CDATA[[ user_password ].SetSecure]]></Disp>
</NodeArgs>
</Step>
<Step rID="T50">
<Obj ><![CDATA[User Password Set]]></Obj>
<Details ><![CDATA[Successfully Set]]></Details>
<Time><![CDATA[23/05/2018 - 22:08:46]]></Time>
<TimeTick>1527093526</TimeTick>
<NodeArgs eType="User" icon="90" nRep="172" status="Passed" Source="Action1" SourceLine="-1" >
<Disp><![CDATA[User Password Set]]></Disp>
</NodeArgs>
</Step>
<Step rID="T51">
<Obj plainTxt="False" ><![CDATA[[ re_password ].Exist]]></Obj>
<Details plainTxt="False" ><![CDATA["Object exists"]]></Details>
<Time><![CDATA[23/05/2018 - 22:08:46]]></Time>
<TimeTick>1527093526</TimeTick>
<NodeArgs eType="Replay" icon="89" nRep="174" Source="Action1" SourceLine="-1" >
<Disp><![CDATA[[ re_password ].Exist]]></Disp>
</NodeArgs>
</Step>
<Step rID="T52">
<Obj plainTxt="False" ><![CDATA[[ re_password ].SetSecure]]></Obj>
<Details plainTxt="False" ><![CDATA["5b005ccbe5c8a2f35ee86f922906d5709d536f1d67bc"]]></Details>
<Time><![CDATA[23/05/2018 - 22:08:46]]></Time>
<TimeTick>1527093526</TimeTick>
<NodeArgs eType="Replay" icon="89" nRep="177" Source="Action1" SourceLine="-1" >
<Disp><![CDATA[[ re_password ].SetSecure]]></Disp>
</NodeArgs>
</Step>
<Step rID="T53">
<Obj ><![CDATA[Confirm Password Set]]></Obj>
<Details ><![CDATA[Successfully Set]]></Details>
<Time><![CDATA[23/05/2018 - 22:08:46]]></Time>
<TimeTick>1527093526</TimeTick>
<NodeArgs eType="User" icon="90" nRep="178" status="Passed" Source="Action1" SourceLine="-1" >
<Disp><![CDATA[Confirm Password Set]]></Disp>
</NodeArgs>
</Step>
<Step rID="T54">
<Obj plainTxt="False" ><![CDATA[[ Save ].Exist]]></Obj>
<Details plainTxt="False" ><![CDATA["Object exists"]]></Details>
<Time><![CDATA[23/05/2018 - 22:08:46]]></Time>
<TimeTick>1527093526</TimeTick>
<NodeArgs eType="Replay" icon="88" nRep="180" Source="Action1" SourceLine="-1" >
<Disp><![CDATA[[ Save ].Exist]]></Disp>
</NodeArgs>
</Step>
<Step rID="T55">
<Obj plainTxt="False" ><![CDATA[[ Save ].Click]]></Obj>
<Details plainTxt="False" ><![CDATA[]]></Details>
<Time><![CDATA[23/05/2018 - 22:08:46]]></Time>
<TimeTick>1527093526</TimeTick>
<NodeArgs eType="Replay" icon="88" nRep="183" Source="Action1" SourceLine="-1" >
<Disp><![CDATA[[ Save ].Click]]></Disp>
</NodeArgs>
</Step>
<Step rID="T56">
<Obj ><![CDATA[Save Button Click]]></Obj>
<Details ><![CDATA[Successfully Clicked]]></Details>
<Time><![CDATA[23/05/2018 - 22:08:46]]></Time>
<TimeTick>1527093526</TimeTick>
<NodeArgs eType="User" icon="90" nRep="184" status="Passed" Source="Action1" SourceLine="-1" >
<Disp><![CDATA[Save Button Click]]></Disp>
</NodeArgs>
</Step>
<Step rID="T57">
<Obj plainTxt="False" ><![CDATA[[ PIM ].Exist]]></Obj>
<Details plainTxt="False" ><![CDATA["Object exists"]]></Details>
<Time><![CDATA[23/05/2018 - 22:08:49]]></Time>
<TimeTick>1527093529</TimeTick>
<NodeArgs eType="Replay" icon="91" nRep="186" Source="Action1" SourceLine="-1" >
<Disp><![CDATA[[ PIM ].Exist]]></Disp>
</NodeArgs>
</Step>
<Step rID="T58">
<Obj plainTxt="False" ><![CDATA[[ PIM ].Click]]></Obj>
<Details plainTxt="False" ><![CDATA[]]></Details>
<Time><![CDATA[23/05/2018 - 22:08:49]]></Time>
<TimeTick>1527093529</TimeTick>
<NodeArgs eType="Replay" icon="91" nRep="189" Source="Action1" SourceLine="-1" >
<Disp><![CDATA[[ PIM ].Click]]></Disp>
</NodeArgs>
</Step>
<Step rID="T59">
<Obj ><![CDATA[PIM Link Click]]></Obj>
<Details ><![CDATA[Successfully Clicked]]></Details>
<Time><![CDATA[23/05/2018 - 22:08:49]]></Time>
<TimeTick>1527093529</TimeTick>
<NodeArgs eType="User" icon="90" nRep="190" status="Passed" Source="Action1" SourceLine="-1" >
<Disp><![CDATA[PIM Link Click]]></Disp>
</NodeArgs>
</Step>
<Step rID="T60">
<Obj plainTxt="False" ><![CDATA[[ Employee List ].Exist]]></Obj>
<Details plainTxt="False" ><![CDATA["Object exists"]]></Details>
<Time><![CDATA[23/05/2018 - 22:08:50]]></Time>
<TimeTick>1527093530</TimeTick>
<NodeArgs eType="Replay" icon="91" nRep="192" Source="Action1" SourceLine="-1" >
<Disp><![CDATA[[ Employee List ].Exist]]></Disp>
</NodeArgs>
</Step>
<Step rID="T61">
<Obj plainTxt="False" ><![CDATA[[ Employee List ].Click]]></Obj>
<Details plainTxt="False" ><![CDATA[]]></Details>
<Time><![CDATA[23/05/2018 - 22:08:51]]></Time>
<TimeTick>1527093531</TimeTick>
<NodeArgs eType="Replay" icon="91" nRep="195" Source="Action1" SourceLine="-1" >
<Disp><![CDATA[[ Employee List ].Click]]></Disp>
</NodeArgs>
</Step>
<Step rID="T62">
<Obj ><![CDATA[Employee List Link Click]]></Obj>
<Details ><![CDATA[Successfully Clicked]]></Details>
<Time><![CDATA[23/05/2018 - 22:08:51]]></Time>
<TimeTick>1527093531</TimeTick>
<NodeArgs eType="User" icon="90" nRep="196" status="Passed" Source="Action1" SourceLine="-1" >
<Disp><![CDATA[Employee List Link Click]]></Disp>
</NodeArgs>
</Step>
<Step rID="T63">
<Obj plainTxt="False" ><![CDATA[[ chkSelectAll ].Exist]]></Obj>
<Details plainTxt="False" ><![CDATA["Object exists"]]></Details>
<Time><![CDATA[23/05/2018 - 22:08:52]]></Time>
<TimeTick>1527093532</TimeTick>
<NodeArgs eType="Replay" icon="92" nRep="198" Source="Action1" SourceLine="-1" >
<Disp><![CDATA[[ chkSelectAll ].Exist]]></Disp>
</NodeArgs>
</Step>
<Step rID="T64">
<Obj plainTxt="False" ><![CDATA[[ chkSelectAll ].Set]]></Obj>
<Details plainTxt="False" ><![CDATA["ON"]]></Details>
<Time><![CDATA[23/05/2018 - 22:08:52]]></Time>
<TimeTick>1527093532</TimeTick>
<NodeArgs eType="Replay" icon="92" nRep="201" Source="Action1" SourceLine="-1" >
<Disp><![CDATA[[ chkSelectAll ].Set]]></Disp>
</NodeArgs>
</Step>
<Step rID="T65">
<Obj ><![CDATA[Select Check box Set]]></Obj>
<Details ><![CDATA[Successfully Set]]></Details>
<Time><![CDATA[23/05/2018 - 22:08:52]]></Time>
<TimeTick>1527093532</TimeTick>
<NodeArgs eType="User" icon="90" nRep="202" status="Passed" Source="Action1" SourceLine="-1" >
<Disp><![CDATA[Select Check box Set]]></Disp>
</NodeArgs>
</Step>
<Step rID="T66">
<Obj plainTxt="False" ><![CDATA[[ Delete ].Exist]]></Obj>
<Details plainTxt="False" ><![CDATA["Object exists"]]></Details>
<Time><![CDATA[23/05/2018 - 22:08:53]]></Time>
<TimeTick>1527093533</TimeTick>
<NodeArgs eType="Replay" icon="88" nRep="204" Source="Action1" SourceLine="-1" >
<Disp><![CDATA[[ Delete ].Exist]]></Disp>
</NodeArgs>
</Step>
<Step rID="T67">
<Obj plainTxt="False" ><![CDATA[[ Delete ].Click]]></Obj>
<Details plainTxt="False" ><![CDATA[]]></Details>
<Time><![CDATA[23/05/2018 - 22:08:53]]></Time>
<TimeTick>1527093533</TimeTick>
<NodeArgs eType="Replay" icon="88" nRep="207" Source="Action1" SourceLine="-1" >
<Disp><![CDATA[[ Delete ].Click]]></Disp>
</NodeArgs>
</Step>
<Step rID="T68">
<Obj ><![CDATA[Delete Button Click]]></Obj>
<Details ><![CDATA[Successfully Clicked]]></Details>
<Time><![CDATA[23/05/2018 - 22:08:53]]></Time>
<TimeTick>1527093533</TimeTick>
<NodeArgs eType="User" icon="90" nRep="208" status="Passed" Source="Action1" SourceLine="-1" >
<Disp><![CDATA[Delete Button Click]]></Disp>
</NodeArgs>
</Step>
<Step rID="T69">
<Obj plainTxt="False" ><![CDATA[[ Ok ].Exist]]></Obj>
<Details plainTxt="False" ><![CDATA["Object exists"]]></Details>
<Time><![CDATA[23/05/2018 - 22:08:54]]></Time>
<TimeTick>1527093534</TimeTick>
<NodeArgs eType="Replay" icon="88" nRep="210" Source="Action1" SourceLine="-1" >
<Disp><![CDATA[[ Ok ].Exist]]></Disp>
</NodeArgs>
</Step>
<Step rID="T70">
<Obj plainTxt="False" ><![CDATA[[ Ok ].Click]]></Obj>
<Details plainTxt="False" ><![CDATA[]]></Details>
<Time><![CDATA[23/05/2018 - 22:08:54]]></Time>
<TimeTick>1527093534</TimeTick>
<NodeArgs eType="Replay" icon="88" nRep="213" Source="Action1" SourceLine="-1" >
<Disp><![CDATA[[ Ok ].Click]]></Disp>
</NodeArgs>
</Step>
<Step rID="T71">
<Obj ><![CDATA[Dialog Delete Button Click]]></Obj>
<Details ><![CDATA[Successfully Clicked]]></Details>
<Time><![CDATA[23/05/2018 - 22:08:54]]></Time>
<TimeTick>1527093534</TimeTick>
<NodeArgs eType="User" icon="90" nRep="214" status="Passed" Source="Action1" SourceLine="-1" >
<Disp><![CDATA[Dialog Delete Button Click]]></Disp>
</NodeArgs>
</Step>
<Step rID="T72">
<Obj plainTxt="False" ><![CDATA[[ WebElement ].Exist]]></Obj>
<Details plainTxt="False" ><![CDATA["Object does not exist"]]></Details>